{
  "schema_version": "1.0",
  "trace_id": "golden",
  "candidate_digest": "sha256:controlled-digital-calibration",
  "observer": {
    "name": "prerecorded-calibration-observer",
    "version": "1.0",
    "sampling": "one sample per declared digital clock cycle"
  },
  "signals": [
    "count"
  ],
  "samples": [
    {
      "cycle": 0,
      "clock": "clk",
      "values": {
        "count": "0"
      }
    },
    {
      "cycle": 1,
      "clock": "clk",
      "values": {
        "count": "0"
      }
    },
    {
      "cycle": 2,
      "clock": "clk",
      "values": {
        "count": "1"
      }
    },
    {
      "cycle": 3,
      "clock": "clk",
      "values": {
        "count": "2"
      }
    },
    {
      "cycle": 4,
      "clock": "clk",
      "values": {
        "count": "3"
      }
    }
  ],
  "provenance": {
    "kind": "prerecorded calibration fixture; not an instrumented candidate result"
  }
}
